keyword,salary_group,job_title,text,tokens,text_cut
数据分析师,非高薪岗位,财务数据分析师（SOP方向）/双休,财务数据分析师（SOP方向）/双休 岗位属于财务运营/数据分析序列，特别欢迎有会计师事务所审计经验、希望转型深入业务一线的候选人。我们将利用您的审计逻辑思维，搭建标准化的业财数据体系。” ● 标准化任务执行 (SOP Execution) ● 严格遵循团队制定的标准作业程序（SOP），高效、准确地完成日常数据提取、清洗、核对及报表输出等既定任务，确保数据处理过程的规范性与可追溯性。 ● 主动更新文档：在逻辑确认后，第一时间修订、更新 SOP 操作手册，做好版本管理，确保“文档即真理”，避免口头传达导致的误差。 ● 版本管理：做好 SOP 的版本记录与归档，协助团队进行知识沉淀，避免因人员流动或流程遗忘导致的操作失误。 ● 业务链路认知与学习 (Business Acumen) ● 主动学习并深入理解所在业务的整体场景与运作模式。 ● 清晰认知自身负责的账务数据在整体“业务 - 财务”链路中的具体节点位置，理解上下游数据流转逻辑，避免机械式操作。 ● 差异分析与问题推进 (Analysis & Problem Solving) ● 在项目主管提供项目背景及“业财转化逻辑”输入后，能够独立执行数据逻辑，输出准确的业财差异数据报表。 ● 具备基础的问题定位能力，能对常见的简单差异进行初步归因分析。 ● 作为执行接口人，主动与相关业务方、技术方沟通差异细节，推动简单问题的闭环解决。 ● 沟通协作与进度管理 (Communication & Delivery) ● 建立高效的汇报机制，在执行过程中遇到阻塞、异常或潜在风险时，第一时间向对接的项目主管预警并寻求支持。 ● 实时同步项目关键节点的完成进度，确保信息透明。 ● 举一反三和风险识别【新增核心项】 ● 敏锐捕捉变化：在执行过程中，若发现业务规则变更、系统逻辑调整或原有 SOP 无法覆盖新场景时，需及时识别并记录。 ● 以结果为导向，保质保量按时交付任务，对最终产出负责。 ● 举一反三项目复制：在同一个业务模式下，当新增产品或新场景出现时，能够快速拆解其与原有成熟产品的异同点，能够自主复制原有的项目方案（如核算逻辑、核对模型、SOP框架），并根据新产品的特性进行适配性调整，和项目主管对焦后，快速输出新场景的业财SOP。 职位要求： ● 学历专业：本科及以上学历，财务、会计、统计学、信息管理或相关专业优先。 ●工作年限：4年以上 ● 技能要求： ● 精通 Excel（透视表、函数），具备优秀的文档编写能力。 ● 具备良好的数据敏感度，对数字差异有敏锐的洞察力。 ● 有 SQL 基础或大数据平台（如 MaxCompute/ODPS）使用经验者优先。 ● 软性素质： ● 极强的迁移学习能力：善于总结规律，能从“一个案子”总结出“一类案子”的方法论，并应用到新场景中。 ● 主动性 (Proactivity)：拒绝“等靠要”，在新需求来临时，能主动基于已有知识库提出解决方案，而非等待指令。 ● 结构化思维：能清晰区分“不变的模式”与“变化的参数”，在复制方案时精准调整变量。 ● 严谨细致：对数据准确性负责，对流程规范性有执念。 ● 工作经验：有财务共享中心、数据核对、审计助理经验 ● 语言：英语能力优先,"['财务数据', '分析师', 'sop', '财务', '运营', '数据分析', '序列', '特别', '会计师', '事务所', '审计', '希望', '转型', '业务', '一线', '利用', '审计', '逻辑思维', '搭建', '标准化', '业财', '数据', '体系', '标准化', 'sop', 'execution', '制定', '标准', '作业', '程序', 'sop', '高效', '准确', '数据', '提取', '清洗', '核对', '报表', '输出', '既定', '确保', '数据处理', '过程', '规范性', '可追溯', '主动', '更新', '文档', '逻辑', '确认', '第一', '时间', '修订', '更新', 'sop', '操作手册', '做好', '版本', '管理', '确保', '文档', '真理', '口头', '传达', '导致', '误差', '版本', '管理', '做好', 'sop', '版本', '记录', '归档', '知识', '沉淀', '流动', '流程', '遗忘', '导致', '操作失误', '业务', '链路', '认知', 'business', 'acumen', '主动', '理解', '业务', '整体', '场景', '运作', '模式', '清晰', '认知', '账务', '数据', '整体', '业务', '财务', '链路', '节点', '位置', '理解', '上下游', '数据', '流转', '逻辑', '机械式', '操作', '差异', '分析', 'analysis', 'problem', 'solving', '项目', '主管', '项目', '背景', '业财', '转化', '逻辑', '输入', '独立', '数据', '逻辑', '输出', '准确', '业财', '差异', '数据报表', '基础', '定位', '常见', '简单', '差异', '初步', '归因', '分析', '接口', '主动', '业务', '技术', '差异', '细节', '推动', '简单', '闭环', '解决', '协作', '进度', '管理', 'communication', 'delivery', '建立', '高效', '汇报', '机制', '过程', '阻塞', '异常', '潜在', '风险', '第一', '时间', '对接', '项目', '主管', '预警', '寻求', '实时', '同步', '项目', '关键', '节点', '进度', '确保', '信息', '透明', '举一反三', '风险', '识别', '新增', '核心', '敏锐', '捕捉', '变化', '过程', '发现', '业务', '规则', '变更', '系统', '逻辑', '调整', '原有', 'sop', '覆盖', '场景', '识别', '记录', '导向', '保质保量', '交付', '最终', '产出', '举一反三', '项目', '复制', '同一个', '业务', '模式', '新增', '产品', '场景', '快速', '拆解', '原有', '成熟', '产品', '异同', '自主', '复制', '原有', '项目', '方案', '核算', '逻辑', '核对', '模型', 'sop', '框架', '产品', '特性', '适配', '调整', '项目', '主管', '对焦', '快速', '输出', '场景', '业财', 'sop', '财务', '会计', '统计学', '信息管理', '年限', '技能', '精通', 'excel', '透视', '函数', '文档', '编写', '数据', '敏感度', '数字', '差异', '敏锐', '洞察力', 'sql', '基础', '数据', '平台', 'maxcompute', 'odps', '软性', '素质', '极强', '迁移', '善于', '规律', '案子', '一类', '案子', '方法论', '场景', '主动性', 'proactivity', '拒绝', '需求', '临时', '主动', '已有', '知识库', '提出', '解决方案', '等待', '指令', '结构化', '思维', '清晰', '区分', '模式', '变化', '参数', '复制', '方案', '精准', '调整', '变量', '严谨', '细致', '数据', '准确性', '流程', '规范性', '执念', '财务', '共享', '中心', '数据', '核对', '审计', '助理', '语言', '英语']",财务数据 分析师 sop 财务 运营 数据分析 序列 特别 会计师 事务所 审计 希望 转型 业务 一线 利用 审计 逻辑思维 搭建 标准化 业财 数据 体系 标准化 sop execution 制定 标准 作业 程序 sop 高效 准确 数据 提取 清洗 核对 报表 输出 既定 确保 数据处理 过程 规范性 可追溯 主动 更新 文档 逻辑 确认 第一 时间 修订 更新 sop 操作手册 做好 版本 管理 确保 文档 真理 口头 传达 导致 误差 版本 管理 做好 sop 版本 记录 归档 知识 沉淀 流动 流程 遗忘 导致 操作失误 业务 链路 认知 business acumen 主动 理解 业务 整体 场景 运作 模式 清晰 认知 账务 数据 整体 业务 财务 链路 节点 位置 理解 上下游 数据 流转 逻辑 机械式 操作 差异 分析 analysis problem solving 项目 主管 项目 背景 业财 转化 逻辑 输入 独立 数据 逻辑 输出 准确 业财 差异 数据报表 基础 定位 常见 简单 差异 初步 归因 分析 接口 主动 业务 技术 差异 细节 推动 简单 闭环 解决 协作 进度 管理 communication delivery 建立 高效 汇报 机制 过程 阻塞 异常 潜在 风险 第一 时间 对接 项目 主管 预警 寻求 实时 同步 项目 关键 节点 进度 确保 信息 透明 举一反三 风险 识别 新增 核心 敏锐 捕捉 变化 过程 发现 业务 规则 变更 系统 逻辑 调整 原有 sop 覆盖 场景 识别 记录 导向 保质保量 交付 最终 产出 举一反三 项目 复制 同一个 业务 模式 新增 产品 场景 快速 拆解 原有 成熟 产品 异同 自主 复制 原有 项目 方案 核算 逻辑 核对 模型 sop 框架 产品 特性 适配 调整 项目 主管 对焦 快速 输出 场景 业财 sop 财务 会计 统计学 信息管理 年限 技能 精通 excel 透视 函数 文档 编写 数据 敏感度 数字 差异 敏锐 洞察力 sql 基础 数据 平台 maxcompute odps 软性 素质 极强 迁移 善于 规律 案子 一类 案子 方法论 场景 主动性 proactivity 拒绝 需求 临时 主动 已有 知识库 提出 解决方案 等待 指令 结构化 思维 清晰 区分 模式 变化 参数 复制 方案 精准 调整 变量 严谨 细致 数据 准确性 流程 规范性 执念 财务 共享 中心 数据 核对 审计 助理 语言 英语
数据分析师,非高薪岗位,软件数据分析师,软件数据分析师 岗位内容： 1. 收集、整理和分析各类数据，为公司提供基础数据和决策支持。 2. 建立和维护各种类型的数据指标和报告，跟踪业务进展和趋势。 3. 参与规划和执行公司数据战略，推动数字化转型和技术创新。 4. 探索和应用数据挖掘和机器学习技术，提高数据价值和利用效率。 任职要求： 1. 具备统计学、数学、计算机科学或相关领域的学士及以上学历。 2. 熟练使用常见的数据分析工具和平台，如Excel、SQL、BI工具等。 3. 具备较强的数据处理和分析能力，可以根据业务需求制定相应的数据方案和报表。 4. 具备团队合作精神和良好的沟通能力，能够与不同职能和层级的人员协作。,"['软件', '数据', '分析师', '内容', '收集', '整理', '分析', '各类', '数据', '基础', '数据', '决策', '建立', '维护', '各种类型', '数据', '指标', '报告', '跟踪', '业务', '进展', '趋势', '规划', '数据', '战略', '推动', '数字化', '转型', '技术创新', '探索', '数据挖掘', '机器学习', '技术', '提高', '数据', '价值', '利用效率', '统计学', '数学', '计算机科学', '领域', '学士', '常见', '数据分析', '平台', 'excel', 'sql', 'bi', '数据处理', '分析', '业务', '需求', '制定', '数据', '方案', '报表', '合作', '精神', '职能', '层级', '协作']",软件 数据 分析师 内容 收集 整理 分析 各类 数据 基础 数据 决策 建立 维护 各种类型 数据 指标 报告 跟踪 业务 进展 趋势 规划 数据 战略 推动 数字化 转型 技术创新 探索 数据挖掘 机器学习 技术 提高 数据 价值 利用效率 统计学 数学 计算机科学 领域 学士 常见 数据分析 平台 excel sql bi 数据处理 分析 业务 需求 制定 数据 方案 报表 合作 精神 职能 层级 协作
数据分析师,高薪岗位,数据分析师助理,数据分析师助理 岗位职责: 1、负责所属板块的信息整理，基本面分析，把握行业发展趋势进行信息数据的收集与整理； 2、对所负责的行业内容及进行深入研究； 3、协助完成在推进过程中的其他工作及领导下发的其他任务； 二、职位要求: 1、具备较强的学习能力和抗压能力，适应力强，能够快速融入团队； 2、逻辑思维清晰，具有良好的职业素养，具有很强的计划和执行能力； 3、人品端正，有责任心，愿与公司一同成长进步； 三、福利待遇： ，1、底薪5000+20%提成，转正后底薪7000+30%提成，综合到手10k-20k以上，1个月后转正，综合到手13k以上； 2、上班时间:周一至周五10-17:30，周六、周日双休， 法定节假日按国家规定带薪休假； 3、员工关怀:定期团队聚餐、下午茶、户外旅游等,"['数据', '分析师', '助理', '所属', '板块', '信息', '整理', '基本面', '分析', '把握', '行业', '发展趋势', '信息', '数据', '收集', '整理', '行业', '内容', '深入研究', '过程', '领导', '下发', '抗压', '适应力', '快速', '融入', '逻辑思维', '清晰', '职业', '素养', '很强', '计划', '人品', '端正', '责任心', '一同', '成长', '福利待遇', '底薪', '20%', '转正', '底薪', '30%', '综合', '到手', '10k', '20k', '转正', '综合', '到手', '13k', '上班时间', '周一', '周五', '周六', '周日', '法定', '节假日', '国家', '带薪休假', '员工', '关怀', '定期', '聚餐', '户外']",数据 分析师 助理 所属 板块 信息 整理 基本面 分析 把握 行业 发展趋势 信息 数据 收集 整理 行业 内容 深入研究 过程 领导 下发 抗压 适应力 快速 融入 逻辑思维 清晰 职业 素养 很强 计划 人品 端正 责任心 一同 成长 福利待遇 底薪 20% 转正 底薪 30% 综合 到手 10k 20k 转正 综合 到手 13k 上班时间 周一 周五 周六 周日 法定 节假日 国家 带薪休假 员工 关怀 定期 聚餐 户外
商业分析师,高薪岗位,商业分析师（医药零售）,商业分析师（医药零售） 岗位职责 1.经营分析：负责业务模块经营分析模型搭建，为业务管理者提供决策支持；包括目标测算、考核设计和追踪，搭建业务健康度的经营分析框架和数据体系，通过目标的拆解和过程指标体系设定，指引业务方向，保证目标达成同时基于该框架，追踪业绩进展，识别关键差距; 2.资源管理：以业务线经营视角全局看业务，产出业务预算规划和自标拆解。并设计对应的资源考核方案，驱动业务目标； 3.关键问题的识别与策略输出：通过内部关键指标追踪和外部动态分析，寻找核心驱动要素，识别业务关键问题，输出洞察和策略建议，帮助业务解决关键问题； 4.项目推进：与其他部门、产品、内审、风控、财务等部门互相合作，负责公司级OKR项目在业务侧的落地执行。 任职要求 1.本科及以上学历；5年以上经营分析、商业分析工作经验，有医药行业、电商、O2O经历更佳； 2.熟悉常见的分析工具和数据分析方法论，SQL熟练，具备较强的建模能力； 3.独立思考，业务敏感度和洞察力强，有良好的逻辑、结构化能力； 4.工作积极主动，有强烈的责任心和严谨的工作作风，具备较强的执行力和抗压力； 5.具备良好的沟通能力和协作精神，有很强的跨部门协调推进力。,"['商业', '分析师', '医药', '零售', '经营', '分析', '业务', '模块', '经营', '分析模型', '搭建', '业务', '管理者', '决策', '目标', '测算', '考核', '设计', '追踪', '搭建', '业务', '健康', '经营', '分析', '框架', '数据', '体系', '目标', '拆解', '过程', '指标体系', '设定', '指引', '业务', '保证', '目标', '达成', '框架', '追踪', '业绩', '进展', '识别', '关键', '差距', '资源管理', '业务', '经营', '视角', '全局', '业务', '产出', '业务', '预算', '规划', '自标', '拆解', '设计', '资源', '考核', '方案', '驱动', '业务', '目标', '关键问题', '识别', '策略', '输出', '内部', '关键', '指标', '追踪', '外部', '动态分析', '寻找', '核心', '驱动', '要素', '识别', '业务', '关键问题', '输出', '洞察', '策略', '建议', '业务', '解决', '关键问题', '项目', '产品', '内审', '风控', '财务', '互相合作', 'okr', '项目', '业务', '落地', '经营', '分析', '商业', '分析', '医药行业', '电商', 'o2o', '经历', '更佳', '常见', '分析', '数据分析', '方法论', 'sql', '建模', '独立思考', '业务', '敏感度', '洞察力', '逻辑', '结构化', '积极主动', '责任心', '严谨', '工作作风', '执行力', '压力', '协作', '精神', '跨部门', '协调', '推进力']",商业 分析师 医药 零售 经营 分析 业务 模块 经营 分析模型 搭建 业务 管理者 决策 目标 测算 考核 设计 追踪 搭建 业务 健康 经营 分析 框架 数据 体系 目标 拆解 过程 指标体系 设定 指引 业务 保证 目标 达成 框架 追踪 业绩 进展 识别 关键 差距 资源管理 业务 经营 视角 全局 业务 产出 业务 预算 规划 自标 拆解 设计 资源 考核 方案 驱动 业务 目标 关键问题 识别 策略 输出 内部 关键 指标 追踪 外部 动态分析 寻找 核心 驱动 要素 识别 业务 关键问题 输出 洞察 策略 建议 业务 解决 关键问题 项目 产品 内审 风控 财务 互相合作 okr 项目 业务 落地 经营 分析 商业 分析 医药行业 电商 o2o 经历 更佳 常见 分析 数据分析 方法论 sql 建模 独立思考 业务 敏感度 洞察力 逻辑 结构化 积极主动 责任心 严谨 工作作风 执行力 压力 协作 精神 跨部门 协调 推进力
商业分析师,非高薪岗位,商业分析师,商业分析师 （需现场面试） 1、 客户财报数据收集、整理及基础分析，如客户年报、季报关键数据整理记录、进行基础客户财报分析及数据支撑等； 2、 外部信息收集和基础分析，如外部行业研究报告信息提取、宏观环境、客户&股东信息、资本市场等。 3、 协助部分财经要素按需展开风险审视基础工作。 4、 IT系统维护支撑，客户财报数字化工作支撑及运营维护。 1、 财经专业/履历优先 2、 熟悉宏观经济及财务管理相关知识； 3、 有英文阅读及沟通能力 4、 熟练使用WORD、EXCEL、PPT等；,"['商业', '分析师', '现场', '面试', '客户', '财报', '数据', '收集', '整理', '基础', '分析', '客户', '年报', '季报', '关键', '数据', '整理', '记录', '基础', '客户', '财报', '分析', '数据', '支撑', '外部', '信息', '收集', '基础', '分析', '外部', '行业', '研究', '报告', '信息提取', '宏观', '环境', '客户', '股东', '信息', '资本', '市场', '财经', '要素', '展开', '风险', '审视', '基础', 'it', '系统维护', '支撑', '客户', '财报', '数字化', '支撑', '运营', '维护', '财经', '履历', '宏观经济', '财务管理', '知识', '英文', '阅读', 'word', 'excel', 'ppt']",商业 分析师 现场 面试 客户 财报 数据 收集 整理 基础 分析 客户 年报 季报 关键 数据 整理 记录 基础 客户 财报 分析 数据 支撑 外部 信息 收集 基础 分析 外部 行业 研究 报告 信息提取 宏观 环境 客户 股东 信息 资本 市场 财经 要素 展开 风险 审视 基础 it 系统维护 支撑 客户 财报 数字化 支撑 运营 维护 财经 履历 宏观经济 财务管理 知识 英文 阅读 word excel ppt
商业分析师,非高薪岗位,商业分析师（BA）-外企-六险一金,商业分析师（BA）-外企-六险一金 岗位职责 1. 负责业务数据的日常监控、多维度分析以及深度挖掘，及时发现数据异常、业务机会与潜在风险，输出可落地的分析结论与优化建议。 2. 独立完成数据提取、清洗、建模、统计分析与可视化报告，支撑业务决策、复盘与策略迭代。对接业务需求，将业务问题转化为数据分析方案，输出专题分析。 3. 搭建与维护数据看板、报表体系，提升数据透明度与业务效率。 4. 参与数据指标体系建设，规范口径，保障数据准确性与一致性。 任职要求 1. 本科及以上学历，统计学、数学、计算机、经济学、数据分析相关专业优先。 2. 具备极强的数据敏感度，对数字、趋势、异常波动高度敏感，能从数据中快速发现问题与规律。 3. 拥有扎实的数据分析实战经验，能独立完成从需求理解、数据取数到结论输出的全流程。 4. 熟练使用 SQL 进行复杂数据查询、多表关联、子查询、数据清洗与汇总。 5. 熟练使用 Python 进行数据分析，能处理数据、做统计分析与简单建模优先。 6. 熟练使用 Tableau 制作可视化看板、报表与交互式图表，能独立搭建数据 dashboard。 7. 逻辑清晰，沟通表达顺畅，能将复杂数据结论用业务语言清晰传递。 8. 责任心强，细致严谨，具备较强的问题拆解与解决能力。,"['商业', '分析师', 'ba', '外企', '六险', '业务', '数据', '监控', '多维度', '分析', '深度', '挖掘', '及时发现', '数据', '异常', '业务', '机会', '潜在', '风险', '输出', '落地', '分析', '结论', '优化', '建议', '独立', '数据', '提取', '清洗', '建模', '统计分析', '可视化', '报告', '支撑', '业务', '决策', '复盘', '策略', '迭代', '对接', '业务', '需求', '业务', '转化', '数据分析', '方案', '输出', '专题', '分析', '搭建', '维护', '数据', '报表', '体系', '提升', '数据', '透明度', '业务', '效率', '数据', '指标体系', '建设', '规范', '口径', '保障', '数据', '准确性', '一致性', '统计学', '数学', '计算机', '经济学', '数据分析', '极强', '数据', '敏感度', '数字', '趋势', '异常', '波动', '高度', '敏感', '数据', '快速', '发现', '规律', '拥有', '扎实', '数据分析', '实战经验', '独立', '需求', '理解', '数据', '取数', '结论', '输出', '流程', 'sql', '数据', '查询', '多表', '关联', '查询', '数据', '清洗', '汇总', 'python', '数据分析', '数据', '统计分析', '简单', '建模', 'tableau', '制作', '可视化', '报表', '交互式', '图表', '独立', '搭建', '数据', 'dashboard', '逻辑', '清晰', '顺畅', '数据', '结论', '业务', '语言', '清晰', '传递', '责任心', '细致', '严谨', '拆解', '解决']",商业 分析师 ba 外企 六险 业务 数据 监控 多维度 分析 深度 挖掘 及时发现 数据 异常 业务 机会 潜在 风险 输出 落地 分析 结论 优化 建议 独立 数据 提取 清洗 建模 统计分析 可视化 报告 支撑 业务 决策 复盘 策略 迭代 对接 业务 需求 业务 转化 数据分析 方案 输出 专题 分析 搭建 维护 数据 报表 体系 提升 数据 透明度 业务 效率 数据 指标体系 建设 规范 口径 保障 数据 准确性 一致性 统计学 数学 计算机 经济学 数据分析 极强 数据 敏感度 数字 趋势 异常 波动 高度 敏感 数据 快速 发现 规律 拥有 扎实 数据分析 实战经验 独立 需求 理解 数据 取数 结论 输出 流程 sql 数据 查询 多表 关联 查询 数据 清洗 汇总 python 数据分析 数据 统计分析 简单 建模 tableau 制作 可视化 报表 交互式 图表 独立 搭建 数据 dashboard 逻辑 清晰 顺畅 数据 结论 业务 语言 清晰 传递 责任心 细致 严谨 拆解 解决
商业分析师,非高薪岗位,商业分析师,商业分析师 1. 分析业务数据，提供可视化报告。 2. 构建数据模型，进行数据挖掘和预测。 3. 为战略决策提供支持。 4. 跟踪行业趋势，分析竞品。 5. 与业务部门合作，推进数据分析工作。 6. 根据数据提出产品优化建议。 感兴趣联系我，欢迎加入我们的团队！,"['商业', '分析师', '分析', '业务', '数据', '可视化', '报告', '构建', '数据模型', '数据挖掘', '预测', '战略决策', '跟踪', '行业', '趋势', '分析', '竞品', '业务部门', '合作', '数据分析', '数据', '提出', '产品', '优化', '建议', '感兴趣']",商业 分析师 分析 业务 数据 可视化 报告 构建 数据模型 数据挖掘 预测 战略决策 跟踪 行业 趋势 分析 竞品 业务部门 合作 数据分析 数据 提出 产品 优化 建议 感兴趣
